{
  "$schema": "https://json-schema.org/draft/2020-12/schema",
  "$id": "urn:nexloop:contracts:v1:run-outcome",
  "title": "run-outcome",
  "description": "NX-024. The result a plan reevaluation Run records through its Host for the current plan version. no_action, needs_information, waiting_external and escalate are normal results, not failures; plan_update supersedes the plan with new steps; action_intent names an intent this very Run submitted. Identity (tenant, world, Run, plan) is derived by the server from the Run's live activation; this body carries none. Grants nothing.",
  "type": "object",
  "additionalProperties": false,
  "properties": {
    "schema_version": {"const": "1.0"},
    "kind": {"enum": ["no_action", "needs_information", "waiting_external", "escalate", "plan_update", "action_intent"]},
    "reasons": {"type": "array", "maxItems": 8, "items": {"type": "string", "minLength": 1, "maxLength": 500}},
    "reassess_at": {"anyOf": [{"type": "null"}, {"type": "string", "format": "date-time", "pattern": "^\\d{4}-\\d{2}-\\d{2}T\\d{2}:\\d{2}:\\d{2}(\\.\\d{1,9})?(Z|\\+00:00)$"}]},
    "evidence_refs": {"type": "array", "maxItems": 32, "items": {"type": "string", "minLength": 3, "maxLength": 512, "pattern": "^[A-Za-z][A-Za-z0-9_.-]*:[^\\s]+$"}},
    "intent_ref": {"anyOf": [{"type": "null"}, {"type": "string", "format": "uuid", "pattern": "^[0-9a-f]{8}-[0-9a-f]{4}-[0-9a-f]{4}-[0-9a-f]{4}-[0-9a-f]{12}$"}]},
    "plan_update": {"anyOf": [{"type": "null"}, {
      "type": "object",
      "additionalProperties": false,
      "properties": {
        "strategy": {"anyOf": [{"type": "null"}, {"type": "string", "minLength": 1, "maxLength": 8192}]},
        "steps": {"type": "array", "minItems": 1, "maxItems": 32, "items": {
          "type": "object",
          "additionalProperties": false,
          "properties": {
            "step_key": {"type": "string", "pattern": "^[a-z0-9][a-z0-9._-]{0,63}$"},
            "step_object_id": {"anyOf": [{"type": "null"}, {"type": "string", "pattern": "^[a-f0-9]{64}$"}]},
            "prerequisites": {"type": "array", "maxItems": 32, "items": {"type": "string", "minLength": 1, "maxLength": 500}},
            "expected_result": {"type": "string", "minLength": 1, "maxLength": 2000},
            "stop_if": {"type": "array", "maxItems": 16, "items": {
              "type": "object",
              "additionalProperties": false,
              "properties": {
                "type_name": {"type": "string", "pattern": "^[A-Za-z][A-Za-z0-9_]{0,63}$"},
                "object_id": {"type": "string", "pattern": "^[a-f0-9]{64}$"},
                "property": {"type": "string", "pattern": "^[A-Za-z][A-Za-z0-9_]{0,63}$"},
                "equals": {}
              },
              "required": ["type_name", "object_id", "property", "equals"]
            }},
            "reassess_at": {"anyOf": [{"type": "null"}, {"type": "string", "format": "date-time", "pattern": "^\\d{4}-\\d{2}-\\d{2}T\\d{2}:\\d{2}:\\d{2}(\\.\\d{1,9})?(Z|\\+00:00)$"}]},
            "budget": {
              "type": "object",
              "additionalProperties": false,
              "properties": {
                "maximum_model_turns": {"type": "integer", "minimum": 1, "maximum": 64},
                "maximum_tool_calls": {"type": "integer", "minimum": 1, "maximum": 128},
                "active_timeout_seconds": {"type": "integer", "minimum": 1, "maximum": 3600}
              },
              "required": ["maximum_model_turns", "maximum_tool_calls", "active_timeout_seconds"]
            },
            "intent_ref": {"anyOf": [{"type": "null"}, {"type": "string", "pattern": "^[0-9a-f]{8}-[0-9a-f]{4}-[0-9a-f]{4}-[0-9a-f]{4}-[0-9a-f]{12}$"}]}
          },
          "required": ["step_key", "step_object_id", "prerequisites", "expected_result", "stop_if", "reassess_at", "budget", "intent_ref"]
        }}
      },
      "required": ["steps", "strategy"]
    }]}
  },
  "required": ["schema_version", "kind", "reasons", "reassess_at", "evidence_refs", "intent_ref", "plan_update"],
  "allOf": [
    {"if": {"properties": {"kind": {"const": "plan_update"}}}, "then": {"properties": {"plan_update": {"type": "object"}}}, "else": {"properties": {"plan_update": {"type": "null"}}}},
    {"if": {"properties": {"kind": {"const": "action_intent"}}}, "then": {"properties": {"intent_ref": {"type": "string"}}}},
    {"if": {"properties": {"kind": {"const": "waiting_external"}}}, "then": {"anyOf": [{"properties": {"reassess_at": {"type": "string"}}}, {"properties": {"intent_ref": {"type": "string"}}}]}}
  ]
}
