{
  "schema_version": "1.0",
  "kind": "plan_update",
  "reasons": ["客户已确认续费意向，下一步在到期前一周确认付款方式"],
  "reassess_at": null,
  "evidence_refs": ["message:4f2a6c1d8e9b0a7c5d3e1f2a4b6c8d0e2f4a6b8c0d2e4f6a8b0c2d4e6f8a0b2c"],
  "intent_ref": null,
  "plan_update": {
    "strategy": null,
    "steps": [
      {
        "step_key": "confirm-payment",
        "step_object_id": null,
        "prerequisites": ["续费意向已确认"],
        "expected_result": "确认付款方式，不催促",
        "stop_if": [{"type_name": "Consumer", "object_id": "1111111111111111111111111111111111111111111111111111111111111111", "property": "renewed", "equals": true}],
        "reassess_at": "2026-11-01T02:00:00Z",
        "budget": {"maximum_model_turns": 8, "maximum_tool_calls": 12, "active_timeout_seconds": 300},
        "intent_ref": null
      }
    ]
  }
}
